{
  "id": "weekly-tips-series",
  "createdAt": "2024-01-01T00:00:00.000Z",
  "name": "Weekly Tips Series",
  "businessId": "acme-brand",
  "description": "Recurring Tuesday tips series sharing actionable advice. One topic per week, adapted across platforms.",
  "status": "active",
  "startDate": "2026-04-06",
  "tier": "hub",
  "platforms": ["instagram", "linkedin", "tiktok"],
  "goal": "engagement"
}
